{
  "schemaVersion": 0,
  "fhirVersion": "4.0.1",
  "producer": {
    "name": "Grove FHIR receiver lifecycle fixtures",
    "version": "0.7.0"
  },
  "packages": [
    {
      "alias": "mobile",
      "packageId": "org.grovealliance.fhir.mobile",
      "version": "0.7.0"
    },
    {
      "alias": "questionnaire",
      "packageId": "org.grovealliance.fhir.questionnaire",
      "version": "0.7.0"
    }
  ],
  "resources": [
    {
      "path": "resources/original.json",
      "requiredProfiles": [
        "https://grovealliance.org/fhir/mobile/StructureDefinition/grove-mobile-exchange-bundle"
      ]
    },
    {
      "path": "resources/corrected.json",
      "requiredProfiles": [
        "https://grovealliance.org/fhir/mobile/StructureDefinition/grove-mobile-exchange-bundle"
      ]
    },
    {
      "path": "resources/altered-retry.json",
      "requiredProfiles": [
        "https://grovealliance.org/fhir/mobile/StructureDefinition/grove-mobile-exchange-bundle"
      ]
    },
    {
      "path": "resources/reformatted-retry.json",
      "requiredProfiles": [
        "https://grovealliance.org/fhir/mobile/StructureDefinition/grove-mobile-exchange-bundle"
      ]
    },
    {
      "path": "resources/lexeme-retry.json",
      "requiredProfiles": [
        "https://grovealliance.org/fhir/mobile/StructureDefinition/grove-mobile-exchange-bundle"
      ]
    },
    {
      "path": "resources/unordered-a.json",
      "requiredProfiles": [
        "https://grovealliance.org/fhir/mobile/StructureDefinition/grove-mobile-exchange-bundle"
      ]
    },
    {
      "path": "resources/unordered-b.json",
      "requiredProfiles": [
        "https://grovealliance.org/fhir/mobile/StructureDefinition/grove-mobile-exchange-bundle"
      ]
    },
    {
      "path": "resources/pending.json",
      "requiredProfiles": [
        "https://grovealliance.org/fhir/mobile/StructureDefinition/grove-mobile-exchange-bundle"
      ]
    },
    {
      "path": "resources/target.json",
      "requiredProfiles": [
        "https://grovealliance.org/fhir/mobile/StructureDefinition/grove-mobile-exchange-bundle"
      ]
    },
    {
      "path": "resources/retraction.json",
      "requiredProfiles": [
        "https://grovealliance.org/fhir/mobile/StructureDefinition/grove-mobile-retraction-bundle"
      ]
    },
    {
      "path": "resources/source-record-target-retraction.json",
      "requiredProfiles": [
        "https://grovealliance.org/fhir/mobile/StructureDefinition/grove-mobile-retraction-bundle"
      ]
    },
    {
      "path": "resources/multi-v1.json",
      "requiredProfiles": [
        "https://grovealliance.org/fhir/mobile/StructureDefinition/grove-mobile-exchange-bundle"
      ]
    },
    {
      "path": "resources/multi-v2.json",
      "requiredProfiles": [
        "https://grovealliance.org/fhir/mobile/StructureDefinition/grove-mobile-exchange-bundle"
      ]
    },
    {
      "path": "resources/multi-v3.json",
      "requiredProfiles": [
        "https://grovealliance.org/fhir/mobile/StructureDefinition/grove-mobile-exchange-bundle"
      ]
    },
    {
      "path": "resources/equal-version-conflict.json",
      "requiredProfiles": [
        "https://grovealliance.org/fhir/mobile/StructureDefinition/grove-mobile-exchange-bundle"
      ]
    },
    {
      "path": "resources/equal-version-reassembly.json",
      "requiredProfiles": [
        "https://grovealliance.org/fhir/mobile/StructureDefinition/grove-mobile-exchange-bundle"
      ]
    },
    {
      "path": "resources/other-writer.json",
      "requiredProfiles": [
        "https://grovealliance.org/fhir/mobile/StructureDefinition/grove-mobile-exchange-bundle"
      ]
    },
    {
      "path": "resources/missing-order.json",
      "requiredProfiles": [
        "https://grovealliance.org/fhir/mobile/StructureDefinition/grove-mobile-exchange-bundle"
      ]
    },
    {
      "path": "resources/changed-source-record.json",
      "requiredProfiles": [
        "https://grovealliance.org/fhir/mobile/StructureDefinition/grove-mobile-exchange-bundle"
      ]
    }
  ],
  "semanticVectors": [
    {
      "id": "heart-rate",
      "path": "resources/original.json",
      "resourcePointer": "/entry/2/resource"
    }
  ]
}
